{
  "schema": "zerosum.money_order.v1",
  "order_id": "01996a3e-8f10-7c2a-9a1e-3d5c7b2e4f04",
  "order_group_id": "trip_8f2c",
  "type": "REFUND",
  "reason": "refund.succeeded",
  "adjusts_order_id": null,
  "source": { "system": "instrument-service", "idempotency_key": "01996a3f-0001-7000-8000-000000000002:REFUND_SUCCEEDED" },
  "entries": [
    { "entity_id": "rider:R1", "account": "receivable", "currency": "USD", "amount_minor": 300 },
    { "entity_id": "provider:fakecard", "account": "clearing", "currency": "USD", "amount_minor": -300 }
  ],
  "metadata": {},
  "effective_at": "2026-09-15T10:21:30.400Z",
  "created_at": "2026-09-15T10:21:30.650Z"
}
