{
  "schema": "zerosum.money_order.v1",
  "order_id": "01996a3e-8f10-7c2a-9a1e-3d5c7b2e4f01",
  "order_group_id": "trip_8f2c",
  "type": "COMMERCE",
  "reason": "trip.completed",
  "adjusts_order_id": null,
  "source": { "system": "trip-simulator", "idempotency_key": "trip_8f2c:completed" },
  "entries": [
    { "entity_id": "rider:R1", "account": "receivable", "currency": "USD", "amount_minor": 2500 },
    { "entity_id": "driver:D1", "account": "payable", "currency": "USD", "amount_minor": -2000 },
    { "entity_id": "platform:main", "account": "revenue", "currency": "USD", "amount_minor": -500 }
  ],
  "metadata": { "trip_id": "trip_8f2c", "commission_bps": 2000 },
  "effective_at": "2026-09-15T10:04:11.201Z",
  "created_at": "2026-09-15T10:04:11.219Z"
}
