{
  "schema": "zerosum.money_order.v1",
  "order_id": "01996a3e-8f10-7c2a-9a1e-3d5c7b2e4f02",
  "order_group_id": "trip_8f2c",
  "type": "COLLECTION",
  "reason": "charge.succeeded",
  "adjusts_order_id": null,
  "source": { "system": "instrument-service", "idempotency_key": "01996a3f-0001-7000-8000-000000000001:CHARGE_SUCCEEDED" },
  "entries": [
    { "entity_id": "provider:fakecard", "account": "clearing", "currency": "USD", "amount_minor": 2500 },
    { "entity_id": "rider:R1", "account": "receivable", "currency": "USD", "amount_minor": -2500 }
  ],
  "metadata": {},
  "effective_at": "2026-09-15T10:04:11.702Z",
  "created_at": "2026-09-15T10:04:12.050Z"
}
