{
  "schema": "zerosum.money_order.v1",
  "order_id": "01996a3e-8f10-7c2a-9a1e-3d5c7b2e4f06",
  "order_group_id": "settlement:fakecard:rpt_2026_09_15:USD",
  "type": "SETTLEMENT",
  "reason": "settlement.received",
  "adjusts_order_id": null,
  "source": { "system": "instrument-service", "idempotency_key": "settlement:fakecard:rpt_2026_09_15:USD" },
  "entries": [
    { "entity_id": "platform:main", "account": "cash", "currency": "USD", "amount_minor": 2098 },
    { "entity_id": "platform:main", "account": "processing_fees", "currency": "USD", "amount_minor": 102 },
    { "entity_id": "provider:fakecard", "account": "clearing", "currency": "USD", "amount_minor": -2200 }
  ],
  "metadata": { "report_id": "rpt_2026_09_15" },
  "effective_at": "2026-09-16T06:00:00.000Z",
  "created_at": "2026-09-16T06:00:00.420Z"
}
